,Title,Publication Title,Conference Name,PublicationType,Author,Item Type,Publication Year,Sector,AppTagGeneral,TechniqueTagGen,TechniqueTagSpec,AppTagSpecific,title,ID16,Analysis of Georeferenced Building Data for the Identification and Evaluation of Thermal Microgrids,Proceedings of the IEEE,,IEEE Transactions (Journal),"Schlueter, A.; Geyer, P.; Cisar, S.",journalArticle,2016,Building Energy Analysis,PortfolioAnalysis,Clustering,Fuzzy Clustering,Targeting,Analysis of Georeferenced Building Data for the Identification and Evaluation of Thermal Microgrids,schlueter_analysis_201622,Application of clustering for the development of retrofit strategies for large building stocks,Advanced Engineering Informatics,,Other Building Sci. Journal,"Geyer, Philipp; SchlÌ_ter, Arno; Cisar, Sasha",journalArticle,2016,Building Energy Analysis,PortfolioAnalysis,Clustering,Multiple Techniques,Targeting,Application of clustering for the development of retrofit strategies for large building stocks,geyer_application_201636,Correlation between occupants and energy consumption,Energy and Buildings,,Energy and Buildings (Journal),"Ahn, Ki-Uhn; Park, Cheol-Soo",journalArticle,2016,Building Energy Analysis,Operations,Rule Extraction,Wavelets,Occupancy Detection,Correlation between occupants and energy consumption,ahn_correlation_2016105,Variability of electricity load patterns and its effect on demand response: A critical peak pricing experiment on Korean commercial and industrial customers,Energy Policy,,Other Elec. Engineering Journal,"Jang, Dongsik; Eom, Jiyong; Jae Park, Min; Jeung Rho, Jae",journalArticle,2016,Building Energy Analysis,SmartMeter,Clustering,K-Means,Classification,Variability of electricity load patterns and its effect on demand response: A critical peak pricing experiment on Korean commercial and industrial customers,jang_variability_20164,A framework for knowledge discovery in massive building automation data and its application in building diagnostics,Automation in Construction,,Automation in Construction (Journal),"Fan, Cheng; Xiao, Fu; Yan, Chengchu",journalArticle,2015,Building Energy Analysis,AnomalyDetection,Novelty Detection,Data Assocation Rules (DAR),Whole Building,A framework for knowledge discovery in massive building automation data and its application in building diagnostics,fan\_framework\_201518,Automated daily pattern filtering of measured building performance data,Automation in Construction,,Automation in Construction (Journal),"Miller, Clayton; Nagy, Zoltíçn; Schlueter, Arno",journalArticle,2015,Building Energy Analysis,PortfolioAnalysis,Motif Detection,Symbolic Aggregate Approximation (SAX),Characterization,Automated daily pattern filtering of measured building performance data,miller\_automated\_20153,A context-aware method for building occupancy prediction,Energy and Buildings,,Energy and Buildings (Journal),"Adamopoulou, Anna A.; Tryferidis, Athanasios M.; Tzovaras, Dimitrios K.",journalArticle,2015,Building Energy Analysis,Operations,Rule Extraction,Markov Models,Occupancy Detection,A context-aware method for building occupancy prediction,adamopoulou\_context-aware\_201552,Identifying energy consumption patterns in the Attica hotel sector using cluster analysis techniques with the aim of reducing hotelsäó» CO2 footprint,Energy and Buildings,,Energy and Buildings (Journal),"Pieri, Stella Panayiota; IoannisTzouvadakis; Santamouris, Mat",journalArticle,2015,Building Energy Analysis,PortfolioAnalysis,Clustering,Multiple Techniques,Classifying,,61,Occupancy schedules learning process through a data mining framework,Energy and Buildings,,Energy and Buildings (Journal),"Däó»Oca, Simona; Hong, Tianzhen",journalArticle,2015,Building Energy Analysis,Operations,Rule Extraction,Multiple Techniques,Occupancy Detection,Occupancy schedules learning process through a data mining framework,doca\_occupancy\_201582,Temporal Knowledge Discovery in Big BAS Data for Building Energy Management,Energy and Buildings,,Energy and Buildings (Journal),"Fan, Cheng; Xiao, Fu; Madsen, Henrik; Wang, Dan",journalArticle,2015,Building Energy Analysis,Operations,Rule Extraction,Data Assocation Rules (DAR),Energy Management,Temporal Knowledge Discovery in Big BAS Data for Building Energy Management,fan\_temporal\_201591,Visualizing building energy demand for building peak energy analysis,Energy and Buildings,,Energy and Buildings (Journal),"Yarbrough, I.; Sun, Q.; Reeves, D. C.; Hackman, K.; Bennett, R.; Henshel, D. S.",journalArticle,2015,Building Energy Analysis,PortfolioAnalysis,Visual Analytics,Energy Information Systems (EIS),Characterization,Visualizing building energy demand for building peak energy analysis,yarbrough\_visualizing\_201571,SMAS: A smart meter data analytics system,Proceedings of the 2015 IEEE 31st International Conference on Data Engineering (ICDE),IEEE International Conference on Data Engineering (ICDE),IEEE Conference,"Liu, Xiufeng; Golab, L.; Ilyas, I.F.",conferencePaper,2015,Computer Science,SmartMeter,Visual Analytics,Pattern Analysis,Customer Class.,SMAS: A smart meter data analytics system,liu\_smas:\_201555,Kernel-based non-parametric clustering for load profiling of big smart meter data,Proceedings of the 2015 IEEE Wireless Communications and Networking Conference (WCNC),IEEE Wireless Communications and Networking Conference (WCNC),IEEE Conference,"Pan, Erte; Li, Husheng; Song, Lingyang; Han, Zhu",conferencePaper,2015,Electrical Engineering,SmartMeter,Clustering,Principal Component Analysis (PCA),Load Profiling,Kernel-based non-parametric clustering for load profiling of big smart meter data,pan\_kernel-based\_201538,Establishing the foundation for energy management on university campuses via data analytics,Proceedings of the IEEE SoutheastCon 2015,IEEE SoutheastCon,IEEE Conference,"Diong, B.; Zheng, G.; Ginn, M.",conferencePaper,2015,Electrical Engineering,PortfolioAnalysis,Visual Analytics,Energy Information Systems (EIS),Characterization,Establishing the foundation for energy management on university campuses via data analytics,diong\_establishing\_201535,Efficient Rule Engine for Smart Building Systems,IEEE Transactions on Computers,,IEEE Transactions (Journal),"Sun, Yan; Wu, Tin-Yu; Zhao, Guotao; Guizani, M.",journalArticle,2015,Electrical Engineering,AnomalyDetection,Novelty Detection,Data Assocation Rules (DAR),Subsystem,Efficient Rule Engine for Smart Building Systems,sun\_efficient\_201546,Fault detection analysis using data mining techniques for a cluster of smart office buildings,Expert Systems with Applications,,Other Building Sci. Journal,"Capozzoli, Alfonso; Lauro, Fiorella; Khan, Imran",journalArticle,2015,Building Energy Analysis,AnomalyDetection,Novelty Detection,Multiple Techniques,Whole Building,Fault detection analysis using data mining techniques for a cluster of smart office buildings,capozzoli\_fault\_201550,Forensically discovering simulation feedback knowledge from a campus energy information system,Proceedings of the 2015 Symposium on Simulation for Architecture and Urban Design (SimAUD 2015),Symposium on Simulation for Architecture and Urban Design (SimAUD),Other Building Sci. Journal,"Miller, Clayton; Schlueter, Arno",conferencePaper,2015,Building Simulation,PortfolioAnalysis,Clustering,Multiple Techniques,Characterization,Forensically discovering simulation feedback knowledge from a campus energy information system,miller\_forensically\_201529,Data and Interfaces for Advanced Building Operations and Maintenance - RP 1633 Final Report,,,Other Building Sci. Journal,"Gayeski, Nicholas; Kleindienst, Sian; Gagne, Jaime; Werntz, Bradley; Cruz, Ryan; Samouhos, Stephen",report,2015,Building Energy Analysis,Operations,Visual Analytics,Energy Information Systems (EIS),Energy Management,,9,A novelty detection approach to identify the occurrence of leakage in smart gas and water grids,Proceedings of the 2015 International Joint Conference on Neural Networks (IJCNN),International Joint Conference on Neural Networks (IJCNN),Other Comp. Sci. Conf.,"Fagiani, Marco; Squartini, Stefano; Severini, Marco; Piazza, Francesco",conferencePaper,2015,Computer Science,SmartMeter,Novelty Detection,Markov Models,Customer Class.,A novelty detection approach to identify the occurrence of leakage in smart gas and water grids,fagiani\_novelty\_201554,Improving load forecast accuracy by clustering consumers using smart meter data,Proceedings of the 2015 International Joint Conference on Neural Networks (IJCNN),International Joint Conference on Neural Networks (IJCNN),Other Comp. Sci. Conf.,"Shahzadeh, Abbas; Khosravi, Abbas; Nahavandi, Saeid",conferencePaper,2015,Computer Science,SmartMeter,Clustering,K-Means,Load Profiling,Improving load forecast accuracy by clustering consumers using smart meter data,shahzadeh\_improving\_20151,A Learning Approach for Energy Efficiency Optimization by Occupancy Detection,Internet of Things. User-Centric IoT,,Other Comp. Sci. Journal,"Mansur, Vitor; Carreira, Paulo; Arsenio, Artur",bookSection,2015,Computer Science,Operations,Clustering,K-Means,Occupancy Detection,A Learning Approach for Energy Efficiency Optimization by Occupancy Detection,mansur\_learning\_201549,Finding the Different Patterns in Buildings Data Using Bag of Words Representation with Clustering,2015 13th International Conference on Frontiers of Information Technology (FIT),2015 13th International Conference on Frontiers of Information Technology (FIT),Other Elec. Engineering Conf.,"Habib, U.; Zucker, G.",conferencePaper,2015,Electrical Engineering,Operations,Motif Detection,Symbolic Aggregate Approximation (SAX),Controls,Finding the Different Patterns in Buildings Data Using Bag of Words Representation with Clustering,habib\_finding\_201542,Evaluation of the performance of clustering algorithms for a high voltage industrial consumer,Engineering Applications of Artificial Intelligence,,Other Elec. Engineering Journal,"Panapakidis, Ioannis; Alexiadis, Minas; Papagiannis, Grigoris",journalArticle,2015,Electrical Engineering,SmartMeter,Clustering,Multiple Techniques,Load Profiling,Evaluation of the performance of clustering algorithms for a high voltage industrial consumer,panapakidis\_evaluation\_20156,A model-based fault detection and diagnostic methodology based on PCA method and wavelet transform,Energy and Buildings,,Energy and Buildings (Journal),"Li, Shun; Wen, Jin",journalArticle,2014,Building Energy Analysis,AnomalyDetection,Novelty Detection,Principal Component Analysis (PCA),Subsystem,A model-based fault detection and diagnostic methodology based on PCA method and wavelet transform,li\_model-based\_201424,Cluster analysis of simulated energy use for LEED certified U.S. office buildings,Energy and Buildings,,Energy and Buildings (Journal),"Heidarinejad, Mohammad; Dahlhausen, Matthew; McMahon, Sean; Pyke, Chris; Srebric, Jelena",journalArticle,2014,Building Energy Analysis,PortfolioAnalysis,Clustering,K-Means,Classifying,Cluster analysis of simulated energy use for LEED certified U.S. office buildings,heidarinejad\_cluster\_201432,Data mining in building automation system for improving building operational performance,Energy and Buildings,,Energy and Buildings (Journal),"Xiao, Fu; Fan, Cheng",journalArticle,2014,Building Energy Analysis,Operations,Rule Extraction,Data Assocation Rules (DAR),Energy Management,Data mining in building automation system for improving building operational performance,xiao\_data\_201425,Clustering time-series energy data from smart meters,Energy Efficiency,,Energy Efficiency (Journal),"Lavin, Alexander; Klabjan, Diego",journalArticle,2014,Building Energy Analysis,SmartMeter,Clustering,K-Means,Load Profiling,Clustering time-series energy data from smart meters,lavin\_clustering\_201416,Application of Data Mining techniques for energy modeling of HVAC sub-systems,Proceedings of eSim 2014 - IBPSA-Canada Conference,IBPSA-Canada Conference (eSim),IBPSA Conference,"Le Cam, M; Zmeureanu, R; Daoud, A",conferencePaper,2014,Building Simulation,AnomalyDetection,Novelty Detection,Principal Component Analysis (PCA),Subsystem,Application of Data Mining techniques for energy modeling of HVAC sub-systems,le\_cam\_application\_201474,Site-Level Energy Monitoring and Analysis using Koopman Operator Methods,Proceedings of the 2014 ASHRAE/IBPSA-USA Building Simulation Conference (SimBuild 2014),IBPSA-USA Building Simulation Conference (SimBuild),IBPSA Conference,"Georgescu, M; Mezic, I",conferencePaper,2014,Building Simulation,PortfolioAnalysis,Visual Analytics,Pattern Analysis,Characterization,Site-Level Energy Monitoring and Analysis using Koopman Operator Methods,georgescu\_site-level\_201494,"e2-Diagnoser: A System for Monitoring, Forecasting and Diagnosing Energy Usage","Data Mining Workshop (ICDMW), 2014 IEEE International Conference on",IEEE International Conference on Data Mining Workshop (ICDMW),IEEE Conference,"Ploennigs, Joern; Chen, Bei; Palmes, Paulito; Lloyd, Raymond",conferencePaper,2014,Electrical Engineering,PortfolioAnalysis,Novelty Detection,Generalized Additive Models (GAM),Classifying,"e2-Diagnoser: A System for Monitoring, Forecasting and Diagnosing Energy Usage",ploennigs\_e2-diagnoser:\_201464,PowerSAX: Fast motif matching in distributed power meter data using symbolic representations,Proceedings of 9th IEEE International Workshop on Practical Issues in Building Sensor Network Applications (SenseApp 2014),IEEE Workshop on Practical Issues in Building Sensor Network Applications (SensApp),IEEE Conference,"Reinhardt, Andreas; Koessler, Sebastian",conferencePaper,2014,Electrical Engineering,SmartMeter,Motif Detection,Symbolic Aggregate Approximation (SAX),Disaggregation,PowerSAX: Fast motif matching in distributed power meter data using symbolic representations,reinhardt\_powersax:\_201434,Divide and Conquer K-Means Clustering of Demand Data Allows Rapid and Accurate Simulations of the British Electricity System,IEEE Transactions on Engineering Management,,IEEE Transactions (Journal),"Green, R.; Staffell, I.; Vasilakos, N.",journalArticle,2014,Electrical Engineering,SmartMeter,Clustering,K-Means,Load Profiling,Divide and Conquer K-Means Clustering of Demand Data Allows Rapid and Accurate Simulations of the British Electricity System,green\_divide\_201459,Mining Building Energy Management System Data Using Fuzzy Anomaly Detection and Linguistic Descriptions,IEEE Transactions on Industrial Informatics,,IEEE Transactions (Journal),"Wijayasekara, D.; Linda, O.; Manic, M.; Rieger, C.",journalArticle,2014,Computer Science,AnomalyDetection,Novelty Detection,Multiple Techniques,Subsystem,Mining Building Energy Management System Data Using Fuzzy Anomaly Detection and Linguistic Descriptions,wijayasekara\_mining\_201468,Real-time detection of anomalous power consumption,Renewable and Sustainable Energy Reviews,,Other Building Sci. Journal,"Chou, Jui-Sheng; Telaga, Abdi Suryadinata",journalArticle,2014,Building Energy Analysis,AnomalyDetection,Clustering,K-Means,Whole Building,Real-time detection of anomalous power consumption,chou\_real-time\_201475,SmartD: Smart Meter Data Analytics Dashboard,Proceedings of the 5th International Conference on Future Energy Systems (e-Energy '14),ACM International Conference on Future Energy Systems (e-Energy),Other Comp. Sci. Conf.,"Jarrah Nezhad, Aylin; Wijaya, Tri Kurniawan; Vasirani, Matteo; Aberer, Karl",conferencePaper,2014,Computer Science,SmartMeter,Visual Analytics,Pattern Analysis,Load Profiling,SmartD: Smart Meter Data Analytics Dashboard,jarrah\_nezhad\_smartd:\_201477,Statistical Anomaly Detection in Mean and Variation of Energy Consumption,Proceedings of the 22nd International Conference on Pattern Recognition (ICPR),International Conference on Pattern Recognition (ICPR),Other Elec. Engineering Conf.,"Chen, Bei; Sinn, Mathieu; Ploennigs, Joern; Schumann, Anika",conferencePaper,2014,Electrical Engineering,AnomalyDetection,Novelty Detection,Generalized Additive Models (GAM),Whole Building,Statistical Anomaly Detection in Mean and Variation of Energy Consumption,chen\_statistical\_201456,Learning decision rules for energy efficient building control,Journal of Process Control,,Other Elec. Engineering Journal,"Domahidi, Alexander; Ullmann, Fabian; Morari, Manfred; Jones, Colin N.",journalArticle,2014,Electrical Engineering,Operations,Rule Extraction,Support Vector Machines (SVM),Controls,Learning decision rules for energy efficient building control,domahidi\_learning\_20147,A new framework for the analysis of large scale multi-rate power data,,,Other Elec. Engineering Journal,"íˆakmak, Hí_seyin Kemí¢l; Maa\s s, Heiko; Bach, Felix; Kí_hnapfel, Uwe G.",book,2014,Electrical Engineering,SmartMeter,Visual Analytics,Multiple Techniques,Customer Class.,A new framework for the analysis of large scale multi-rate power data,cakmak\_new\_201478,"Strip, bind, and search: a method for identifying abnormal energy consumption in buildings",Proceedings of the 12th ACM/IEEE Int Conference on Information Processing in Sensor Network (ISPN 2013),ACM/IEEE Int Conference on Information Processing in Sensor Network (ISPN),ACM Conference,"Fontugne, Romain; Ortiz, Jorge; Tremblay, Nicolas; Borgnat, Pierre; Flandrin, Patrick; Fukuda, Kensuke; Culler, David; Esaki, Hiroshi",conferencePaper,2013,Computer Science,AnomalyDetection,Novelty Detection,Multiple Techniques,Whole Building,"Strip, bind, and search: a method for identifying abnormal energy consumption in buildings",fontugne\_strip\_201343,Exploiting Generalized Additive Models for Diagnosing Abnormal Energy Use in Buildings,Proceedings of the 5th ACM Workshop On Embedded Systems For Energy-Efficient Buildings (Buildsys '13),ACM Workshop on Embedded Sensing Systems for Energy-Efficiency in Buildings (BuildSys),ACM Conference,"Ploennigs, Joern; Chen, Bei; Schumann, Anika; Brady, Niall",conferencePaper,2013,Electrical Engineering,AnomalyDetection,Novelty Detection,Generalized Additive Models (GAM),Whole Building,Exploiting Generalized Additive Models for Diagnosing Abnormal Energy Use in Buildings,ploennigs\_exploiting\_201384,Towards Automatic Spatial Verification of Sensor Placement in Buildings,Proceedings of the 5th ACM Workshop on Embedded Systems For Energy-Efficient Buildings (BuildSys 2013),ACM Workshop on Embedded Sensing Systems for Energy-Efficiency in Buildings (BuildSys),ACM Conference,"Hong, Dezhi; Ortiz, Jorge; Whitehouse, Kamin; Culler, David",conferencePaper,2013,Computer Science,Operations,Clustering,Empirical Mode Decomposition (EMC),Controls,Towards Automatic Spatial Verification of Sensor Placement in Buildings,hong\_towards\_201330,Data association mining for identifying lighting energy waste patterns in educational institutes,Energy and Buildings,,Energy and Buildings (Journal),"Cabrera, David F Motta; Zareipour, Hamidreza",journalArticle,2013,Building Energy Analysis,PortfolioAnalysis,Rule Extraction,Data Assocation Rules (DAR),Targeting,Data association mining for identifying lighting energy waste patterns in educational institutes,cabrera\_data\_201358,Mining Anomalous Electricity Consumption Using Ensemble Empirical Mode Decomposition,"Acoustics, Speech and Signal Processing (ICASSP), 2013 IEEE International Conference on","IEEE Int. Conference on Acoustics, Speech and Signal Processing (ICASSP)",IEEE Conference,"Fontugne, Romain; Tremblay, Nicolas; Borgnat, Pierre; Flandrin, Patrick; Esaki, Hiroshi",conferencePaper,2013,Computer Science,AnomalyDetection,Novelty Detection,Empirical Mode Decomposition (EMC),Component,Mining Anomalous Electricity Consumption Using Ensemble Empirical Mode Decomposition,fontugne\_mining\_201336,Electrical Load Pattern Grouping Based on Centroid Model With Ant Colony Clustering,IEEE Transactions on Power Systems,,IEEE Transactions (Journal),"Chicco, Gianfranco; Ionel, O-M; Porumb, Radu",journalArticle,2013,Electrical Engineering,SmartMeter,Clustering,Ant Colony,Load Profiling,Electrical Load Pattern Grouping Based on Centroid Model With Ant Colony Clustering,chicco\_electrical\_201345,Extraction of supervisory building control rules from model predictive control of windows in a mixed mode building,Journal of Building Performance Simulation,,Journal of Building Performance Simulation,"May-Ostendorp, Peter T; Henze, Gregor P; Rajagopalan, Balaji; Corbin, Charles D",journalArticle,2013,Building Simulation,Operations,Rule Extraction,Data Assocation Rules (DAR),Controls,Extraction of supervisory building control rules from model predictive control of windows in a mixed mode building,may-ostendorp\_extraction\_201344,Extracting knowledge from building-related data äóî A data mining framework,Building Simulation,,Other Building Sci. Journal,"Yu, Zhun Jerry; Fung, Benjamin C M; Haghighat, Fariborz",journalArticle,2013,Building Simulation,Operations,Rule Extraction,Data Assocation Rules (DAR),Energy Management,,12,Analysis of Similarity Measures in Times Series Clustering for the Discovery of Building Energy Patterns,Energies,,Other Elec. Engineering Journal,"Iglesias, Fí©lix; Kastner, Wolfgang",journalArticle,2013,Electrical Engineering,SmartMeter,Clustering,Multiple Techniques,Load Profiling,Analysis of Similarity Measures in Times Series Clustering for the Discovery of Building Energy Patterns,iglesias\_analysis\_201340,Evaluating a data clustering approach for life-cycle facility control,Journal of Information Technology in Construction,,Other Building Sci. Journal,"Bogen, A C; Rashid, M; East, E W; Ross, J",journalArticle,2013,Building Energy Analysis,Operations,Clustering,Multiple Techniques,Controls,Evaluating a data clustering approach for life-cycle facility control,bogen\_evaluating\_201365,Prediction of Chiller Power Consumption Using Time Series Analysis and Artificial Neural Networks,"Proceedings of the 8th International Conference on Indoor Air Quality, Ventilation and Energy Conservation in Buildings (CLIMA 2013)","International Conference on Indoor Air Quality, Ventilation and Energy Conservation in Buildings (CLIMA)",Other Building Sci. Journal,"Fan, Cheng; Xiao, Fu; Shengwei, Wang",conferencePaper,2013,Building Energy Analysis,Operations,Clustering,K-Means,Controls,Prediction of Chiller Power Consumption Using Time Series Analysis and Artificial Neural Networks,fan\_prediction\_201381,Targeted Efficiency: Using Customer Meter Data to Improve Efficiency Program Outcomes,,,Other Building Sci. Journal,"Borgeson, Sam",thesis,2013,Building Energy Analysis,SmartMeter,Clustering,Multiple Techniques,Customer Class.,,2,A Temporal Motif Mining Approach to Unsupervised Energy Disaggregation: Applications to Residential and Commercial Buildings,Proceedings of the Twenty-Seventh AAAI Conference on Artificial Intelligence (AAAI 2013),Conference on Artificial Intelligence (AAAI),Other Comp. Sci. Conf.,"Shao, Huijuan; Marwah, Manish; Ramakrishnan, Naren",conferencePaper,2013,Computer Science,SmartMeter,Motif Detection,Dirichlet Process Gaussian Mixture Models (DPGMM),Disaggregation,A Temporal Motif Mining Approach to Unsupervised Energy Disaggregation: Applications to Residential and Commercial Buildings,shao\_temporal\_201314,Anomaly detection for visual analytics of power consumption data,Computers & Graphics,,Other Comp. Sci. Journal,"Janetzko, Halldí_r; Stoffel, Florian; Mittelstí_dt, Sebastian; Keim, Daniel A",journalArticle,2013,Computer Science,AnomalyDetection,Visual Analytics,Pattern Analysis,Whole Building,Anomaly detection for visual analytics of power consumption data,janetzko\_anomaly\_201313,Analysis of electricity bills using visual continuous maps,Neural Computing and Applications,,Other Comp. Sci. Journal,"Moríçn, A; Fuertes, J J; Domí_nguez, M; Prada, M A; Alonso, S; Barrientos, P",journalArticle,2013,Computer Science,PortfolioAnalysis,Visual Analytics,Pattern Analysis,Characterization,Analysis of electricity bills using visual continuous maps,moran\_analysis\_201333,Discovering unexpected information using a building energy visualization tool,Proceedings of the IS&T/SPIE 2013 Conference on Electronic Imaging,IS&T/SPIE Conference on Electronic Imaging,SPIE Conference,"Lange, B; Rodriguez, N; Puech, W; Vasques, X",conferencePaper,2013,Electrical Engineering,Operations,Visual Analytics,Pattern Analysis,Energy Management,Discovering unexpected information using a building energy visualization tool,lange\_discovering\_201322,Classification of Commerical Building Electrical Demand Profiles for Energy Storage Applications,"Proceedings of ASME 2012 6th International Conference on Energy Sustainability & 10th Fuel Cell Science, Engineering and Technology Conference (ESFuelCell2012)",ASME International Conference on Energy Sustainability,Other Building Sci. Journal,"Florita, Anthony R; Brackney, Larry J; Otanicar, Todd P; Robertson, Jeffrey",conferencePaper,2012,Building Simulation,SmartMeter,Clustering,Bayesian,Customer Class.,Classification of Commerical Building Electrical Demand Profiles for Energy Storage Applications,florita\_classification\_20128,A novel methodology for knowledge discovery through mining associations between building operational data,Energy and Buildings,,Energy and Buildings (Journal),"Yu, Zhun Jerry; Haghighat, Fariborz; Fung, Benjamin C M; Zhou, Liang",journalArticle,2012,Building Energy Analysis,AnomalyDetection,Rule Extraction,Data Assocation Rules (DAR),Component,A novel methodology for knowledge discovery through mining associations between building operational data,yu\_novel\_2012